{
  "updatedAt": "2025-06-01T10:24:35+08:00",
  "city": "上海市",
  "weather": {
    "temperatureC": 25,
    "condition": "小雨"
  },
  "urbanStatus": {
    "critical": 3,
    "warning": 12,
    "normal": 137
  },
  "activeFloodPoints": 26,
  "waterloggingSituation": {
    "totalEvents": 1,
    "changeVsHour": 108.0,
    "disposition": {
      "pending": 0,
      "handling": 1,
      "relieved": 0
    },
    "topDistricts": [
      {
        "district": "黄浦区",
        "eventCount": 1
      }
    ],
    "metrics": {
      "maxDepthCm": 28.6,
      "avgDepthCm": 28.6,
      "avgResponseMinutes": 32.4,
      "newToday": 1
    },
    "source": "FIXTURE_DERIVED"
  }
}
